{
  "$schema": "https://json-schema.org/draft/2020-12/schema",
  "$id": "https://elmogps.local/integration-contract/v1/envelope.schema.json",
  "title": "ELMOGPS Integration Event Envelope v1",
  "type": "object",
  "additionalProperties": false,
  "required": [
    "event_id",
    "event_type",
    "event_version",
    "occurred_at",
    "source",
    "odoo_company_id",
    "payload"
  ],
  "properties": {
    "event_id": {
      "type": "string",
      "format": "uuid"
    },
    "event_type": {
      "type": "string",
      "pattern": "^[a-z]+\\.[a-z_]+$"
    },
    "event_version": {
      "type": "integer",
      "minimum": 1
    },
    "occurred_at": {
      "type": "string",
      "format": "date-time"
    },
    "source": {
      "type": "string",
      "const": "odoo"
    },
    "odoo_company_id": {
      "type": "integer",
      "minimum": 1
    },
    "payload": {
      "type": "object"
    }
  }
}